{"agents": [{"name": "support-agent", "tools": {"tickets.get": {"mode": "scoped", "constraints": [{"arg": "ticket_id", "op": "eq", "ctx": "ticket.id", "invariant": "inv-6"}]}, "tickets.add_note": {"mode": "scoped", "constraints": [{"arg": "ticket_id", "op": "eq", "ctx": "ticket.id", "invariant": "inv-5"}]}, "billing.invoice_read": {"mode": "scoped", "constraints": [{"arg": "invoice_id", "op": "in", "ctx": "customer.invoice_ids", "invariant": "inv-2"}]}, "billing.invoice_list": {"mode": "scoped", "constraints": [{"arg": "customer_id", "op": "eq", "ctx": "customer.id", "invariant": "inv-1"}]}, "billing.invoice_list_all": {"mode": "deny"}, "billing.refund": {"mode": "approval", "constraints": [{"arg": "invoice_id", "op": "in", "ctx": "customer.invoice_ids", "invariant": "inv-3"}]}, "mail.send": {"mode": "scoped", "constraints": [{"arg": "to", "op": "eq", "ctx": "ticket.customer.email", "invariant": "inv-4"}]}}}], "legs_per_session": {"U": true, "S": true, "X": "bounded"}, "solver": {"status": "OPTIMAL", "method": "cp-sat", "objective": 8, "broken_tasks": []}, "conflicts": [{"task": "refund_request", "legs": ["U", "S", "X"], "core": ["billing.refund"], "fixes": [{"type": "approval_edge", "tool": "billing.refund"}, {"type": "split_agent", "partition": [["tickets.get", "tickets.add_note", "mail.send"], ["billing.invoice_read", "billing.invoice_list", "billing.refund"]]}], "resolved_by": "approval_edge"}]}
